{
  "documentType": "d2p:body-model-snapshot",
  "schemaVersion": "1.0.0",
  "bodyModelId": "bms_golden-drape-individual",
  "createdAt": "2026-01-09T00:00:00Z",
  "source": {
    "kind": "body-measurement-profile",
    "bodyMeasurementProfileRef": {
      "artifactId": "art_golden-drape-individual-profile",
      "revisionId": "rev_golden-drape-individual-profile-r1"
    }
  },
  "avatarProfile": {
    "id": "d2p:standard-a-pose",
    "version": "1.0.0"
  },
  "pose": "d2p:a-pose",
  "backend": {
    "backendId": "conformance-kit-ring-body",
    "backendVersion": "1.0.0",
    "adapterVersion": "1.0.0"
  },
  "inputDigests": [
    {
      "role": "avatar-profile",
      "id": {
        "id": "d2p:standard-a-pose",
        "version": "1.0.0"
      },
      "digest": "sha256:eb2094d481aa927d2f18cb8773e02dc4efb8ef4ad403d88ccffbabc6992760f9"
    },
    {
      "role": "body-measurement-profile",
      "artifactRef": {
        "artifactId": "art_golden-drape-individual-profile",
        "revisionId": "rev_golden-drape-individual-profile-r1"
      },
      "digest": "sha256:4beed1dacabf1b2c2d02235620c49cb3a6505d9b8942a385a260bb6da29c0c67"
    },
    {
      "role": "measurement-definition-registry",
      "id": {
        "id": "d2p:measurement-definitions",
        "version": "1.1.0"
      },
      "digest": "sha256:073a7e1c999b84f5b13d9bddaa36074e3f09215c3c09a17411639ef652ddd291"
    }
  ],
  "status": "succeeded",
  "coordinateSystem": {
    "handedness": "right",
    "up": "+y",
    "front": "+z"
  },
  "sceneUnit": "m",
  "unitConversion": {
    "from": "mm",
    "to": "m",
    "factor": 0.001
  },
  "mesh": {
    "positionsM": [
      [
        0,
        0.7722,
        0.126513887
      ],
      [
        0.064553025,
        0.7722,
        0.116883591
      ],
      [
        0.119278437,
        0.7722,
        0.089458827
      ],
      [
        0.155844788,
        0.7722,
        0.048414769
      ],
      [
        0.168685183,
        0.7722,
        0
      ],
      [
        0.155844788,
        0.7722,
        -0.048414769
      ],
      [
        0.119278437,
        0.7722,
        -0.089458827
      ],
      [
        0.064553025,
        0.7722,
        -0.116883591
      ],
      [
        0,
        0.7722,
        -0.126513887
      ],
      [
        -0.064553025,
        0.7722,
        -0.116883591
      ],
      [
        -0.119278437,
        0.7722,
        -0.089458827
      ],
      [
        -0.155844788,
        0.7722,
        -0.048414769
      ],
      [
        -0.168685183,
        0.7722,
        0
      ],
      [
        -0.155844788,
        0.7722,
        0.048414769
      ],
      [
        -0.119278437,
        0.7722,
        0.089458827
      ],
      [
        -0.064553025,
        0.7722,
        0.116883591
      ],
      [
        0,
        0.8405,
        0.133172513
      ],
      [
        0.067950552,
        0.8405,
        0.123035359
      ],
      [
        0.125556249,
        0.8405,
        0.094167187
      ],
      [
        0.164047145,
        0.8405,
        0.050962914
      ],
      [
        0.17756335,
        0.8405,
        0
      ],
      [
        0.164047145,
        0.8405,
        -0.050962914
      ],
      [
        0.125556249,
        0.8405,
        -0.094167187
      ],
      [
        0.067950552,
        0.8405,
        -0.123035359
      ],
      [
        0,
        0.8405,
        -0.133172513
      ],
      [
        -0.067950552,
        0.8405,
        -0.123035359
      ],
      [
        -0.125556249,
        0.8405,
        -0.094167187
      ],
      [
        -0.164047145,
        0.8405,
        -0.050962914
      ],
      [
        -0.17756335,
        0.8405,
        0
      ],
      [
        -0.164047145,
        0.8405,
        0.050962914
      ],
      [
        -0.125556249,
        0.8405,
        0.094167187
      ],
      [
        -0.067950552,
        0.8405,
        0.123035359
      ],
      [
        0,
        1.0584,
        0.110961157
      ],
      [
        0.056617329,
        1.0584,
        0.102514742
      ],
      [
        0.104615182,
        1.0584,
        0.078461387
      ],
      [
        0.136686323,
        1.0584,
        0.042462996
      ],
      [
        0.147948209,
        1.0584,
        0
      ],
      [
        0.136686323,
        1.0584,
        -0.042462996
      ],
      [
        0.104615182,
        1.0584,
        -0.078461387
      ],
      [
        0.056617329,
        1.0584,
        -0.102514742
      ],
      [
        0,
        1.0584,
        -0.110961157
      ],
      [
        -0.056617329,
        1.0584,
        -0.102514742
      ],
      [
        -0.104615182,
        1.0584,
        -0.078461387
      ],
      [
        -0.136686323,
        1.0584,
        -0.042462996
      ],
      [
        -0.147948209,
        1.0584,
        0
      ],
      [
        -0.136686323,
        1.0584,
        0.042462996
      ],
      [
        -0.104615182,
        1.0584,
        0.078461387
      ],
      [
        -0.056617329,
        1.0584,
        0.102514742
      ],
      [
        0,
        1.209,
        0.127776765
      ],
      [
        0.065197401,
        1.209,
        0.118050338
      ],
      [
        0.120469089,
        1.209,
        0.090351817
      ],
      [
        0.157400451,
        1.209,
        0.048898051
      ],
      [
        0.17036902,
        1.209,
        0
      ],
      [
        0.157400451,
        1.209,
        -0.048898051
      ],
      [
        0.120469089,
        1.209,
        -0.090351817
      ],
      [
        0.065197401,
        1.209,
        -0.118050338
      ],
      [
        0,
        1.209,
        -0.127776765
      ],
      [
        -0.065197401,
        1.209,
        -0.118050338
      ],
      [
        -0.120469089,
        1.209,
        -0.090351817
      ],
      [
        -0.157400451,
        1.209,
        -0.048898051
      ],
      [
        -0.17036902,
        1.209,
        0
      ],
      [
        -0.157400451,
        1.209,
        0.048898051
      ],
      [
        -0.120469089,
        1.209,
        0.090351817
      ],
      [
        -0.065197401,
        1.209,
        0.118050338
      ],
      [
        0,
        1.3796,
        0.142544915
      ],
      [
        0.07273277,
        1.3796,
        0.131694329
      ],
      [
        0.134392634,
        1.3796,
        0.100794476
      ],
      [
        0.175592439,
        1.3796,
        0.054549577
      ],
      [
        0.190059886,
        1.3796,
        0
      ],
      [
        0.175592439,
        1.3796,
        -0.054549577
      ],
      [
        0.134392634,
        1.3796,
        -0.100794476
      ],
      [
        0.07273277,
        1.3796,
        -0.131694329
      ],
      [
        0,
        1.3796,
        -0.142544915
      ],
      [
        -0.07273277,
        1.3796,
        -0.131694329
      ],
      [
        -0.134392634,
        1.3796,
        -0.100794476
      ],
      [
        -0.175592439,
        1.3796,
        -0.054549577
      ],
      [
        -0.190059886,
        1.3796,
        0
      ],
      [
        -0.175592439,
        1.3796,
        0.054549577
      ],
      [
        -0.134392634,
        1.3796,
        0.100794476
      ],
      [
        -0.07273277,
        1.3796,
        0.131694329
      ],
      [
        0,
        1.4196,
        0.048589048
      ],
      [
        0.024792298,
        1.4196,
        0.044890427
      ],
      [
        0.045810194,
        1.4196,
        0.034357645
      ],
      [
        0.059853902,
        1.4196,
        0.018594224
      ],
      [
        0.064785397,
        1.4196,
        0
      ],
      [
        0.059853902,
        1.4196,
        -0.018594224
      ],
      [
        0.045810194,
        1.4196,
        -0.034357645
      ],
      [
        0.024792298,
        1.4196,
        -0.044890427
      ],
      [
        0,
        1.4196,
        -0.048589048
      ],
      [
        -0.024792298,
        1.4196,
        -0.044890427
      ],
      [
        -0.045810194,
        1.4196,
        -0.034357645
      ],
      [
        -0.059853902,
        1.4196,
        -0.018594224
      ],
      [
        -0.064785397,
        1.4196,
        0
      ],
      [
        -0.059853902,
        1.4196,
        0.018594224
      ],
      [
        -0.045810194,
        1.4196,
        0.034357645
      ],
      [
        -0.024792298,
        1.4196,
        0.044890427
      ],
      [
        0,
        1.495378,
        0.075909288
      ],
      [
        0.038732303,
        1.495378,
        0.070131038
      ],
      [
        0.071567963,
        1.495378,
        0.053675973
      ],
      [
        0.09350805,
        1.495378,
        0.029049227
      ],
      [
        0.101212385,
        1.495378,
        0
      ],
      [
        0.09350805,
        1.495378,
        -0.029049227
      ],
      [
        0.071567963,
        1.495378,
        -0.053675973
      ],
      [
        0.038732303,
        1.495378,
        -0.070131038
      ],
      [
        0,
        1.495378,
        -0.075909288
      ],
      [
        -0.038732303,
        1.495378,
        -0.070131038
      ],
      [
        -0.071567963,
        1.495378,
        -0.053675973
      ],
      [
        -0.09350805,
        1.495378,
        -0.029049227
      ],
      [
        -0.101212385,
        1.495378,
        0
      ],
      [
        -0.09350805,
        1.495378,
        0.029049227
      ],
      [
        -0.071567963,
        1.495378,
        0.053675973
      ],
      [
        -0.038732303,
        1.495378,
        0.070131038
      ],
      [
        0,
        0.7722,
        0
      ],
      [
        0,
        1.6802,
        0
      ],
      [
        0.089005248,
        0.067208,
        0.035047869
      ],
      [
        0.102417487,
        0.067208,